{
  "felles": {
    "søkerNavn": "Dolly Duck",
    "søkerPersonnummer": "300220 12345",
    "fritekst": "Tekst\n- Attest\n- Bekreftelse\nMer tekst",
    "brevDato": "4. april 2020",
    "erKopi": false,
    "harVerge": false,
    "saksnummer": "123456789",
    "ytelseType": "FP",
    "behandlesAvKA": false
  },
  "førstegangsbehandling": false,
  "revurdering": true,
  "endringssøknad": true,
  "død": false,
  "klage": false,
  "søknadDato": "1. april 2020",
  "fristDato": "24. mai 2020"
}